{
  "teamId": "44444444-4444-4444-8444-444444444444",
  "projectId": "33333333-3333-4333-8333-333333333333",
  "title": "Create the initial contract baseline",
  "description": "Add executable schemas and compatibility fixtures.",
  "stateId": "55555555-5555-4555-8555-555555555555",
  "priority": "high",
  "assigneeId": "22222222-2222-4222-8222-222222222222"
}
